{
  "config_sha256": "c42f9eb5e438f88409f74a8e70767c774a33a6cfb7c05da8a5f64e68d123f4b4",
  "cpu_topology": {
    "logical_cpu_count": 16,
    "minimum_reserved_physical_cores": 8,
    "physical_core_count": 16,
    "recommended_concurrency": 8,
    "reserved_physical_cores": 8,
    "selected_cores": [
      {
        "core_id": 0,
        "cpu_id": 0,
        "node_id": 0,
        "physical_id": "0:0",
        "socket_id": 0
      },
      {
        "core_id": 1,
        "cpu_id": 1,
        "node_id": 0,
        "physical_id": "0:1",
        "socket_id": 0
      },
      {
        "core_id": 2,
        "cpu_id": 2,
        "node_id": 0,
        "physical_id": "0:2",
        "socket_id": 0
      },
      {
        "core_id": 3,
        "cpu_id": 3,
        "node_id": 0,
        "physical_id": "0:3",
        "socket_id": 0
      },
      {
        "core_id": 4,
        "cpu_id": 4,
        "node_id": 0,
        "physical_id": "0:4",
        "socket_id": 0
      },
      {
        "core_id": 5,
        "cpu_id": 5,
        "node_id": 0,
        "physical_id": "0:5",
        "socket_id": 0
      },
      {
        "core_id": 6,
        "cpu_id": 6,
        "node_id": 0,
        "physical_id": "0:6",
        "socket_id": 0
      },
      {
        "core_id": 7,
        "cpu_id": 7,
        "node_id": 0,
        "physical_id": "0:7",
        "socket_id": 0
      }
    ]
  },
  "episode_count": 512,
  "episodes": [
    {
      "episode_id": "o10-g0201-p1001",
      "graph_seed": 201,
      "horizon": 32,
      "order": 10,
      "policy_seed": 1001,
      "shard_id": "shard-00"
    },
    {
      "episode_id": "o10-g0201-p1002",
      "graph_seed": 201,
      "horizon": 32,
      "order": 10,
      "policy_seed": 1002,
      "shard_id": "shard-01"
    },
    {
      "episode_id": "o10-g0201-p1003",
      "graph_seed": 201,
      "horizon": 32,
      "order": 10,
      "policy_seed": 1003,
      "shard_id": "shard-02"
    },
    {
      "episode_id": "o10-g0201-p1004",
      "graph_seed": 201,
      "horizon": 32,
      "order": 10,
      "policy_seed": 1004,
      "shard_id": "shard-03"
    },
    {
      "episode_id": "o10-g0201-p1005",
      "graph_seed": 201,
      "horizon": 32,
      "order": 10,
      "policy_seed": 1005,
      "shard_id": "shard-04"
    },
    {
      "episode_id": "o10-g0201-p1006",
      "graph_seed": 201,
      "horizon": 32,
      "order": 10,
      "policy_seed": 1006,
      "shard_id": "shard-05"
    },
    {
      "episode_id": "o10-g0201-p1007",
      "graph_seed": 201,
      "horizon": 32,
      "order": 10,
      "policy_seed": 1007,
      "shard_id": "shard-06"
    },
    {
      "episode_id": "o10-g0201-p1008",
      "graph_seed": 201,
      "horizon": 32,
      "order": 10,
      "policy_seed": 1008,
      "shard_id": "shard-07"
    },
    {
      "episode_id": "o10-g0201-p1009",
      "graph_seed": 201,
      "horizon": 32,
      "order": 10,
      "policy_seed": 1009,
      "shard_id": "shard-00"
    },
    {
      "episode_id": "o10-g0201-p1010",
      "graph_seed": 201,
      "horizon": 32,
      "order": 10,
      "policy_seed": 1010,
      "shard_id": "shard-01"
    },
    {
      "episode_id": "o10-g0201-p1011",
      "graph_seed": 201,
      "horizon": 32,
      "order": 10,
      "policy_seed": 1011,
      "shard_id": "shard-02"
    },
    {
      "episode_id": "o10-g0201-p1012",
      "graph_seed": 201,
      "horizon": 32,
      "order": 10,
      "policy_seed": 1012,
      "shard_id": "shard-03"
    },
    {
      "episode_id": "o10-g0201-p1013",
      "graph_seed": 201,
      "horizon": 32,
      "order": 10,
      "policy_seed": 1013,
      "shard_id": "shard-04"
    },
    {
      "episode_id": "o10-g0201-p1014",
      "graph_seed": 201,
      "horizon": 32,
      "order": 10,
      "policy_seed": 1014,
      "shard_id": "shard-05"
    },
    {
      "episode_id": "o10-g0201-p1015",
      "graph_seed": 201,
      "horizon": 32,
      "order": 10,
      "policy_seed": 1015,
      "shard_id": "shard-06"
    },
    {
      "episode_id": "o10-g0201-p1016",
      "graph_seed": 201,
      "horizon": 32,
      "order": 10,
      "policy_seed": 1016,
      "shard_id": "shard-07"
    },
    {
      "episode_id": "o10-g0201-p1017",
      "graph_seed": 201,
      "horizon": 32,
      "order": 10,
      "policy_seed": 1017,
      "shard_id": "shard-00"
    },
    {
      "episode_id": "o10-g0201-p1018",
      "graph_seed": 201,
      "horizon": 32,
      "order": 10,
      "policy_seed": 1018,
      "shard_id": "shard-01"
    },
    {
      "episode_id": "o10-g0201-p1019",
      "graph_seed": 201,
      "horizon": 32,
      "order": 10,
      "policy_seed": 1019,
      "shard_id": "shard-02"
    },
    {
      "episode_id": "o10-g0201-p1020",
      "graph_seed": 201,
      "horizon": 32,
      "order": 10,
      "policy_seed": 1020,
      "shard_id": "shard-03"
    },
    {
      "episode_id": "o10-g0201-p1021",
      "graph_seed": 201,
      "horizon": 32,
      "order": 10,
      "policy_seed": 1021,
      "shard_id": "shard-04"
    },
    {
      "episode_id": "o10-g0201-p1022",
      "graph_seed": 201,
      "horizon": 32,
      "order": 10,
      "policy_seed": 1022,
      "shard_id": "shard-05"
    },
    {
      "episode_id": "o10-g0201-p1023",
      "graph_seed": 201,
      "horizon": 32,
      "order": 10,
      "policy_seed": 1023,
      "shard_id": "shard-06"
    },
    {
      "episode_id": "o10-g0201-p1024",
      "graph_seed": 201,
      "horizon": 32,
      "order": 10,
      "policy_seed": 1024,
      "shard_id": "shard-07"
    },
    {
      "episode_id": "o10-g0201-p1025",
      "graph_seed": 201,
      "horizon": 32,
      "order": 10,
      "policy_seed": 1025,
      "shard_id": "shard-00"
    },
    {
      "episode_id": "o10-g0201-p1026",
      "graph_seed": 201,
      "horizon": 32,
      "order": 10,
      "policy_seed": 1026,
      "shard_id": "shard-01"
    },
    {
      "episode_id": "o10-g0201-p1027",
      "graph_seed": 201,
      "horizon": 32,
      "order": 10,
      "policy_seed": 1027,
      "shard_id": "shard-02"
    },
    {
      "episode_id": "o10-g0201-p1028",
      "graph_seed": 201,
      "horizon": 32,
      "order": 10,
      "policy_seed": 1028,
      "shard_id": "shard-03"
    },
    {
      "episode_id": "o10-g0201-p1029",
      "graph_seed": 201,
      "horizon": 32,
      "order": 10,
      "policy_seed": 1029,
      "shard_id": "shard-04"
    },
    {
      "episode_id": "o10-g0201-p1030",
      "graph_seed": 201,
      "horizon": 32,
      "order": 10,
      "policy_seed": 1030,
      "shard_id": "shard-05"
    },
    {
      "episode_id": "o10-g0201-p1031",
      "graph_seed": 201,
      "horizon": 32,
      "order": 10,
      "policy_seed": 1031,
      "shard_id": "shard-06"
    },
    {
      "episode_id": "o10-g0201-p1032",
      "graph_seed": 201,
      "horizon": 32,
      "order": 10,
      "policy_seed": 1032,
      "shard_id": "shard-07"
    },
    {
      "episode_id": "o10-g0202-p1001",
      "graph_seed": 202,
      "horizon": 32,
      "order": 10,
      "policy_seed": 1001,
      "shard_id": "shard-00"
    },
    {
      "episode_id": "o10-g0202-p1002",
      "graph_seed": 202,
      "horizon": 32,
      "order": 10,
      "policy_seed": 1002,
      "shard_id": "shard-01"
    },
    {
      "episode_id": "o10-g0202-p1003",
      "graph_seed": 202,
      "horizon": 32,
      "order": 10,
      "policy_seed": 1003,
      "shard_id": "shard-02"
    },
    {
      "episode_id": "o10-g0202-p1004",
      "graph_seed": 202,
      "horizon": 32,
      "order": 10,
      "policy_seed": 1004,
      "shard_id": "shard-03"
    },
    {
      "episode_id": "o10-g0202-p1005",
      "graph_seed": 202,
      "horizon": 32,
      "order": 10,
      "policy_seed": 1005,
      "shard_id": "shard-04"
    },
    {
      "episode_id": "o10-g0202-p1006",
      "graph_seed": 202,
      "horizon": 32,
      "order": 10,
      "policy_seed": 1006,
      "shard_id": "shard-05"
    },
    {
      "episode_id": "o10-g0202-p1007",
      "graph_seed": 202,
      "horizon": 32,
      "order": 10,
      "policy_seed": 1007,
      "shard_id": "shard-06"
    },
    {
      "episode_id": "o10-g0202-p1008",
      "graph_seed": 202,
      "horizon": 32,
      "order": 10,
      "policy_seed": 1008,
      "shard_id": "shard-07"
    },
    {
      "episode_id": "o10-g0202-p1009",
      "graph_seed": 202,
      "horizon": 32,
      "order": 10,
      "policy_seed": 1009,
      "shard_id": "shard-00"
    },
    {
      "episode_id": "o10-g0202-p1010",
      "graph_seed": 202,
      "horizon": 32,
      "order": 10,
      "policy_seed": 1010,
      "shard_id": "shard-01"
    },
    {
      "episode_id": "o10-g0202-p1011",
      "graph_seed": 202,
      "horizon": 32,
      "order": 10,
      "policy_seed": 1011,
      "shard_id": "shard-02"
    },
    {
      "episode_id": "o10-g0202-p1012",
      "graph_seed": 202,
      "horizon": 32,
      "order": 10,
      "policy_seed": 1012,
      "shard_id": "shard-03"
    },
    {
      "episode_id": "o10-g0202-p1013",
      "graph_seed": 202,
      "horizon": 32,
      "order": 10,
      "policy_seed": 1013,
      "shard_id": "shard-04"
    },
    {
      "episode_id": "o10-g0202-p1014",
      "graph_seed": 202,
      "horizon": 32,
      "order": 10,
      "policy_seed": 1014,
      "shard_id": "shard-05"
    },
    {
      "episode_id": "o10-g0202-p1015",
      "graph_seed": 202,
      "horizon": 32,
      "order": 10,
      "policy_seed": 1015,
      "shard_id": "shard-06"
    },
    {
      "episode_id": "o10-g0202-p1016",
      "graph_seed": 202,
      "horizon": 32,
      "order": 10,
      "policy_seed": 1016,
      "shard_id": "shard-07"
    },
    {
      "episode_id": "o10-g0202-p1017",
      "graph_seed": 202,
      "horizon": 32,
      "order": 10,
      "policy_seed": 1017,
      "shard_id": "shard-00"
    },
    {
      "episode_id": "o10-g0202-p1018",
      "graph_seed": 202,